N_move,Standard_notation,UCI_notation,FEN_notation,Comment
1,e4,e2e4,rnbqkbnr/pppppppp/8/8/4P3/8/PPPP1PPP/RNBQKBNR b KQkq - 0 1,"Ik heb gemerkt dat jij in onze partijen meestal opent met e2-e4 en daar is zeker niets mis mee. Veel trainers bevelen deze zet aan voor beginners, omdat de partij vaak in rap tempo tactisch wordt. Dit is belangrijk, omdat de uitslag van schaakpartijen voor verreweg de grootste deel afhankelijk is van de tactische sterkte van de spelers. 

Nadat ik zoveel nadruk leg op tactiek vraag jij je waarschijnlijk af wat tactiek in het schaakspel nou is. Aangezien ik nu genant veel moeite heb om een korte uitleg te geven, zal ik jou helaas moeten vervelen met een zeer lange uitleg. 

Het uiteindelijke doel van schaken is het schaakmat zetten van de tegenstander. In de vorige partij die ik analyseerde gaf jij twee stukken weg, zodat jij de koning van de tegenstander beter kon aanvallen. Jouw tegenstander verdedigde echter tegen de dreigingen, begon stukken af te ruilen en kon jou uiteindelijk mat zetten toen jij geen stukken meer over had. Een directe koningsaanval heeft dus lang niet altijd zin en ik zal later eens uitleggen hoe jij kunt inschatten wanneer een koningsaanval kans heeft op slagen en wanneer niet. Ik ga er nu niet op in, omdat op jouw sterkte partijen meestal worden gewonnen door het verkrijgen van een ruime materiaal voordeel. Ik geloof dat jij nu enigzins weet hoe de waarde van de stukken verhouden ten opzichte van elkaar en dus zal ik daar niet diep op in gaan. Wel zal ik zeggen dat zelfs een Pion (de minst waardevolle eenhoud van jouw team) het verschil kan maken tussen winst en verlies. Je mag hem dus niet zonder nadenken offeren of weggeven. Materiaal is belangrijk!
Hoe ontstaan verschillen in materiaal? Ze ontstaan doordat stukken van verschillende waarde met elkaar worden geruild of omdat een stuk/pion gratis gepakt kan worden. Als jij ziet dat materiaal van de tegenstander gepakt kan worden zonder dat het jou iets kost dan is dat gunstig voor jou en moet jij er voor gaan. Als jij iets kan pakken van de tegenstander dat een grotere waarde heeft dan de stuk/pion die jij er voor moet geven dan is dat ook gunstig. Kijk er echter tegerlijkertijd voor uit dat jijzelf geen van zulke kansen geeft voor de tegenstander.
Hopelijk heb ik tot nu toe niets gezegd dat helemaal nieuw voor jou is en ik denk dat jij bovenstaand al goed begrijpt. Toch zal je merken dat jij soms materiaal verliest, terwijl jij dacht dat de tegenstander niets gratis kon pakken. Plotseling bedreigt één zet van de tegenstander meerdere stukken van jou en je kan niet voorkomen dat er iets genomen gaat worden. Dat is tactiek. Op zijn simpelst is tactiek een dubbelaanval. Er wordt met één zet meer bedreigt dan dat er met één zet verdedigt kan worden. Er zijn echter ook andere motieven waarmee materiaalwinst kan worden afgedwongen. Het is erg belangrijk in schaken om te herkennen wanneer jij een kans hebt om materiaalwinst af te dwingen door zulke tactische wendingen. Het is minstens zo belangrijk om te herkennen wanneer jijzelf kwetsbaar bent voor iets dergelijks."
2,e6,e7e6,rnbqkbnr/pppp1ppp/4p3/8/4P3/8/PPPP1PPP/RNBQKBNR w KQkq - 0 2,"Bij de vorige zet zei ik dat e2-e4 leidt tot meer tactische stellingen. Daarmee bedoel ik dat je vaak posities op het bord krijgt waar tactische wendingen mogelijk zijn. Na bijvoorbeeld de volgende zetten:
1. e2-e4        e7-e5
2. Pg1-Pf3     Pc8-Pc6
3. Lf1-b5
De witte paard valt de pion op e5 aan en dus heeft zwart hem verdedigt met zijn paard. Als wit de pion nu zou nemen, zou dat hem een paard kosten. Met zijn laatste zet valt wit echter de verdediger van de pion aan. Als zwart een zet zou passen kan wit de zwarte paard nemen met zijn loper en nadat zwart de loper terug neemt kan wit de pion op e5 alsnog nemen met zijn paard, want de verdediger is weg. Deze tactische motief (het aanvallen/verwijderen van de verdediger) komt erg vaak voor en is zeker iets om op te letten.

Zwart speelt e7-e6, de Franse verdediging. Net als na e7-e5 maakt de pion de weg vrij voor de loper en dame, doordat de pion zich echter een beetje inhoudt, heeft zwart minder ruimte in de centrum. Dat kan het moeilijker maken om bepaalde stukken actief te maken. Daar tegenover staat dat wit minder zwaktes heeft om op te mikken. Er is geen hangende pion dat verdediging nodig heeft en het zwakke punt f7 is minder gemakkelijk om aan te vallen. Meestal wordt deze zet opgevolgd door d7-d5, zodat zwart alsnog een aandeel heeft in de centrum. In deze partij heeft zwart iets anders voor ogen."
3,d4,d2d4,rnbqkbnr/pppp1ppp/4p3/8/3PP3/8/PPP2PPP/RNBQKBNR b KQkq - 0 2,Prima. Jij neemt een groot aandeel in de centrum en opent de weg voor jouw stukken om actieve velden te vinden.
4,Nc6,b8c6,r1bqkbnr/pppp1ppp/2n1p3/8/3PP3/8/PPP2PPP/RNBQKBNR w KQkq - 1 3,"Niet echt goed of slecht, slechts mogelijk. Zwart ontwikkelt een stuk en valt jouw d-pion aan. De d-pion is op het moment verdedigt door de dame en zwart kan hem daarom niet nemen."
5,c4,c2c4,r1bqkbnr/pppp1ppp/2n1p3/8/2PPP3/8/PP3PPP/RNBQKBNR b KQkq - 0 3,"Jij besluit nog meer ruimte te nemen. Geen slechte beslissing, maar wees bij een grote centrum bewust dat hij ook een groot doelwit is. Hou goed in de gaten of de centrumpionnen wel of niet genomen kunnen worden en negeer jouw stuk ontwikkeling niet."
6,Bb4+,f8b4,r1bqk1nr/pppp1ppp/2n1p3/8/1bPPP3/8/PP3PPP/RNBQKBNR w KQkq - 1 4,"Goed, de schaak wordt onderbroken en een stuk wordt 'actief' gemaakt. De paard kan echter helaas niet bewegen, omdat zijn eigen koning er achter staat. Situaties waarin stukken niet mogen bewegen, omdat een lijn onderbroken moet blijven worden penningen genoemd. In dit geval is de paard het gepende stuk. Penningen worden gerekend tot de tactische motieven, omdat het makkelijk is materiaal te verliezen in een dergelijke situatie."
7,Nc3,b1c3,r1bqk1nr/pppp1ppp/2n1p3/8/1bPPP3/2N5/PP3PPP/R1BQKBNR b KQkq - 2 4,"Goed, de schaak wordt onderbroken en een stuk wordt 'actief' gemaakt. De paard kan echter helaas niet bewegen, omdat zijn eigen koning er achter staat. Situaties waarin stukken niet mogen bewegen, omdat een lijn onderbroken moet blijven worden penningen genoemd. In dit geval is de paard het gepende stuk. Penningen worden gerekend tot de tactische motieven, omdat het makkelijk is materiaal te verliezen in een dergelijke situatie."
8,Nf6,g8f6,r1bqk2r/pppp1ppp/2n1pn2/8/1bPPP3/2N5/PP3PPP/R1BQKBNR w KQkq - 3 5,"Zwart blijft zijn stukken snel naar buiten halen en is nu klaar voor rochade. Tevens valt de paard nu de pion op e4 aan. Op eerste gezicht lijkt het misschien dat deze pion verdedigt wordt door de paard op c3. Helaas is deze paard gepend en zal hij niet terug kunnen nemen op e4. Gepende stukken zijn slechte verdedigers!
Omdat de paard op c3 geen echte verdediger is, kan de pion op e4 gratis genomen worden als wit hem niet verdedigt. Er moet dus een verdediger voor e4 gevonden worden. Helaas voor wit is dit nog redelijk lastig. Lf1-d3 dekt de pion op e4, maar blokkeert de verdediging die de dame geeft aan de pion op d4. Een ander idee is Lc1-d2. Hierna staat de paard op c3 niet meer gepend en heeft de e4-pion een echte verdediger. Helaas blokkeert dit wederom de verdediging van de d4-pion, maar er is nog een probleem. Zelfs als de paard niet gepend zou staan, kan zwart een pion winnen door eerst de paard te slaan met zijn loper (Lb4xc3). De verdediger wordt weer uitgeschakeld, zodat de pion gratis kan worden genomen. Dd1-d3 dekt werkelijk alle pionnen en voor de moment hoeft wit geen materiaal te verliezen. Het is echter wel een beetje vernederend voor een machtige dame om kleine pionnetjes te moeten dekken. Ook kan een dame makkelijk worden weggejaagd van zijn verdediging vanwege zijn grote waarde. Ik zou hier waarschijnlijk e4-e5 gespeeld hebben."
9,Be2,f1e2,r1bqk2r/pppp1ppp/2n1pn2/8/1bPPP3/2N5/PP2BPPP/R1BQK1NR b KQkq - 4 5,"? 
De eerste fout van de partij. De gepende paard op c3 gaf geen dekking aan de pion op e4 en dus kan zwart hem nu gratis nemen. Beter was Dd1-d3 of e4-e5."
10,Nxe4,f6e4,r1bqk2r/pppp1ppp/2n1p3/8/1bPPn3/2N5/PP2BPPP/R1BQK1NR w KQkq - 0 6,"De positie wordt ingewikkelder en tactischer. Beide zijden moet goed opletten wat voor mogelijkheden de tegenstander heeft. Jij had waarschijnlijk gemerkt dat de paard gepend was en had daarom besloten om hem snel te bevrijden. De paard is nu niet meer gepend aan de koning. Ook geeft de loper nu extra dekking aan de paard op c3 die twee maal wordt aangevallen (door paard en loper). 
Daar staat tegenover dat de pion op d4 nu niet meer gedekt wordt door de dame. De hangende stuk op e4 is echter meer waard als de hangende pion op d4 en dus is dit geen probleem. Als zwart de pion op d4 neemt kan jij de paard op e4 nemen. Een paard is veel meer waard als twee pionnen en de materiaal voordeel zal jou de betere winstkansen geven.
Als zwart besluit eerst de paard af te ruilen, kan jij terugnemen met de loper, waarna de pion op d4 zijn verdediging terug krijgt. Dit zou desondanks een stuk beter zijn geweest. De extra pion die zwart in die variatie zou hebben gehad, geeft hem een duidelijk voordeel."
11,Bd2,c1d2,r1bqk2r/pppp1ppp/2n1p3/8/1bPPn3/2N5/PP1BBPPP/R2QK1NR b KQkq - 1 6,"De positie wordt ingewikkelder en tactischer. Beide zijden moet goed opletten wat voor mogelijkheden de tegenstander heeft. Jij had waarschijnlijk gemerkt dat de paard gepend was en had daarom besloten om hem snel te bevrijden. De paard is nu niet meer gepend aan de koning. Ook geeft de loper nu extra dekking aan de paard op c3 die twee maal wordt aangevallen (door paard en loper). 
Daar staat tegenover dat de pion op d4 nu niet meer gedekt wordt door de dame. De hangende stuk op e4 is echter meer waard als de hangende pion op d4 en dus is dit geen probleem. Als zwart de pion op d4 neemt kan jij de paard op e4 nemen. Een paard is veel meer waard als twee pionnen en de materiaal voordeel zal jou de betere winstkansen geven.
Als zwart besluit eerst de paard af te ruilen, kan jij terugnemen met de loper, waarna de pion op d4 zijn verdediging terug krijgt. Dit zou desondanks een stuk beter zijn geweest. De extra pion die zwart in die variatie zou hebben gehad, geeft hem een duidelijk voordeel."
12,Nxd4,c6d4,r1bqk2r/pppp1ppp/4p3/8/1bPnn3/2N5/PP1BBPPP/R2QK1NR w KQkq - 0 7,"?
Gewoon een foutje"
13,Nxe4,c3e4,r1bqk2r/pppp1ppp/4p3/8/1bPnN3/8/PP1BBPPP/R2QK1NR b KQkq - 0 7,Zwart heeft zijn paard weggegeven en heeft er te weinig voor terug. Wit heeft hier een duidelijk voordeel.
14,Be7,b4e7,r1bqk2r/ppppbppp/4p3/8/2PnN3/8/PP1BBPPP/R2QK1NR w KQkq - 1 8,"?!
De zwarte loper stond aangevallen en dus moest er iets aan gedaan worden. Zwart besloot zijn loper terug te trekken, maar hij had ook de optie om de loper af te ruilen op d2 of te verdedigen met bijvoorbeeld De8-e7. De beslissing is niet een makkelijke om te maken. Door de verlies van een paard staat zwart materiaal achter en dat lijkt te betekenen dat hij zoveel mogelijk materiaal op het bord moet houden, terwijl wit zoveel mogelijk zou willen afruilen. Het verschil van dat ene paard wordt immers groter naarmate er minder materiaal op het bord staat. Volgens die principe deed zwart de juiste beslissing door de loper op het bord te houden. 
Zwart moet echter ook rekening houden met de aanvalsmogelijkheden van wit. Wit heeft nu meer actieve stukken als zwart en kan aardig wat druk zetten op de zwarte kamp. Door de activiteit van zijn stukken kan wit zelfs tactische mogelijkheden krijgen. Afruil zou in die opzicht misschien juist geweest zijn om een beetje druk uit de stelling te houden. Het kan erg lastig zijn om dergelijke conflicterende afwegingen tegen elkaar op te wegen. Ik vermoed dat afruil beter zou zijn geweest."
15,Ba5,d2a5,r1bqk2r/ppppbppp/4p3/B7/2PnN3/8/PP2BPPP/R2QK1NR b KQkq - 2 8,"?!
Een volgende tactische motief: de ontdekte aanval. Het vertrekken van de loper opent de aanval van de witte dame op de paard op d4. Ontdekte aanvallen kunnen erg sterk zijn, omdat er zo makkelijk een dubbele dreiging kan worden opgezet. Als de loper een ongedekte pion/stuk zou aanvallen, zouden er twee stukken/pionnen verdedigd moeten worden door de tegenstander. Helaas kan wit in dit geval geen goed gebruik maken van de ontdekte aanval, want de zwarte paard is de enige voor de hand liggende doelwit.
-Vraagje 1 = Waarom zou Loper naar h6 niet werken? De loper zou een pion (g7) aanvallen die niet verdedigd is en de paard zou worden aangevallen door de dame.-
(Antwoorden op vragen aan de einde van de partij. Als je het liever niet wilt doen, kan je natuurlijk direct naar het einde gaan om het antwoord te lezen.)
Wit heeft echter een andere tactische wapen beschikbaar door de activiteit van zijn stukken. Als wit op dit moment Ld2-c3 zou spelen, zou zwart grote problemen hebben. De paard is zwaar onder vuur, maar als hij vertrekt wordt er een lijn naar g7 geopent. Hij lijkt dus gepend te zijn aan de pion op g7. Maar wacht eens even, zwart kan zijn paard op f5 zetten (Pd4-f5) en op die manier zowel pion als paard redden. Op dat moment komt echter een andere tactische motief naar voren. Als de zwarte paard op f5 staat is hij de enige verdediger van de pion op g7. Zulke verdedigers vallen wij aan. Na g7-g5 staat de zwarte paard aangevallen door een pion, maar als hij vlucht kan de witte loper op c3 de pion op g7 slaan (Lc3xg7). Na Ld2-c3 wint wit een pion. 
De tactische mogelijkheden kwamen, omdat de witte stukken actiever waren als die van zwart en omdat zwart hangend (onverdedigd) materiaal heeft."
16,b6,b7b6,r1bqk2r/p1ppbppp/1p2p3/B7/2PnN3/8/PP2BPPP/R2QK1NR w KQkq - 0 9,"?
In de partij speelde jij echter La5. De loperzet opende de aanval op de paard, maar hier valt helaas makkelijk tegen te verdedigen. Na Pd4-c6 zou zwart zijn paard in veiligheid hebben gebracht en de loper aanvallen. Aangezien wit de loper moet verdedigen of terugtrekken heeft hij/zij onnodig tijd verloren. In de partij koos zwart echter voor b6. Hij krijgt voor zijn paard jouw loper, maar rekent niet ver genoeg. Nadat jij de paard neemt, valt jouw dame namelijk zijn pion op g7 aan. Zwart verliest dus onnodig een pion."
17,Qxd4,d1d4,r1bqk2r/p1ppbppp/1p2p3/B7/2PQN3/8/PP2BPPP/R3K1NR b KQkq - 0 9,"?!
Zwart besluit om zijn koning op e7 te gaan zetten, zodat de dame zijn aangevallen toren zou dekken. Dit plan heeft echter een groot probleem. Het was beter om de loper op e7 te houden, zodat de veld f6 bewaakt blijft."
18,bxa5,b6a5,r1bqk2r/p1ppbppp/4p3/p7/2PQN3/8/PP2BPPP/R3K1NR w KQkq - 0 10,"?!
Zwart besluit om zijn koning op e7 te gaan zetten, zodat de dame zijn aangevallen toren zou dekken. Dit plan heeft echter een groot probleem. Het was beter om de loper op e7 te houden, zodat de veld f6 bewaakt blijft."
19,Qxg7,d4g7,r1bqk2r/p1ppbpQp/4p3/p7/2P1N3/8/PP2BPPP/R3K1NR b KQkq - 0 10,"?!
Zwart besluit om zijn koning op e7 te gaan zetten, zodat de dame zijn aangevallen toren zou dekken. Dit plan heeft echter een groot probleem. Het was beter om de loper op e7 te houden, zodat de veld f6 bewaakt blijft."
20,Bb4+,e7b4,r1bqk2r/p1pp1pQp/4p3/p7/1bP1N3/8/PP2BPPP/R3K1NR w KQkq - 1 11,"?!
Zwart besluit om zijn koning op e7 te gaan zetten, zodat de dame zijn aangevallen toren zou dekken. Dit plan heeft echter een groot probleem. Het was beter om de loper op e7 te houden, zodat de veld f6 bewaakt blijft."
21,Kd1,e1d1,r1bqk2r/p1pp1pQp/4p3/p7/1bP1N3/8/PP2BPPP/R2K2NR b kq - 2 11,Wit houdt terecht zijn paard in de centrum! De combinatie paar + dame kan erg dodelijk en zwart heeft geen actieve stukken om de witte koning mee te bedreigen. Wellicht was f1 een veiligere veld voor de koning.
22,Ke7,e8e7,r1bq3r/p1ppkpQp/4p3/p7/1bP1N3/8/PP2BPPP/R2K2NR w - - 3 12,"?
Dit had de partij direct kunnen verliezen. Wit heeft een grote kans om zijn materiaalvoordeel te vergroten met een mooie toren."
23,Nf6,e4f6,r1bq3r/p1ppkpQp/4pN2/p7/1bP5/8/PP2BPPP/R2K2NR b - - 4 12,"?
Jammer, je had gezien dat de veld f6 zwak was voor zwart, maar helaas de verkeerde stuk er neer gezet. Dg7-f6 met schaak zou erg sterk zijn geweest. 
12. Dg7-f6+    Ke7-e8/f8 (de koning moet terug en daardoor is de toren onverdedigd)
13. Df6xh8+    Ke8/f8-e7
14. Dh8xd8+  (Wit heeft een grote materiaal voordeel en wil dus graag verder afruilen.)
Door de gemiste kans blijft zwart enigzins in leven. De koning van wit is immers ook niet al te veilig."
24,Kd6,e7d6,r1bq3r/p1pp1pQp/3kpN2/p7/1bP5/8/PP2BPPP/R2K2NR w - - 5 13,"?
Een erg vreemde zet. Ik snap niet waarom zwart dit zou willen doen. De koning is hier nog onveiliger en zwart mist een kans op tegenspel. Ik heb geen computeranalyse bij de hand, maar d7-d5 lijkt mij gevaarlijker voor wit. Waarschijnlijk is wit nog steeds oke met een paar verdedigende zetten (c4-c5 om de d-lijn dicht te houden?), maar het is beter dan Kd6."
25,Ne4+,f6e4,r1bq3r/p1pp1pQp/3kp3/p7/1bP1N3/8/PP2BPPP/R2K2NR b - - 6 13,De positie is complex en ik ben moe. Een gedetaileerde analyse komt hier dus niet. Mijn gevoel zegt mij dat Pf6-e4 met schaak een goede zet moet zijn. De zwarte koning is in veel gevaar.
