N_move,Standard_notation,UCI_notation,FEN_notation,Comment
1,d4,d2d4,rnbqkbnr/pppppppp/8/8/3P4/8/PPP1PPPP/RNBQKBNR b KQkq - 0 1,"Nearly all my games on the Fast Ladder have been against lower-rated opposition whom I challenged because they were higher up the ladder, so in most I have been Black.  Recently, the tables have been turned on me as higher-rated played lower down the ladder have challenged me.  Here is one such challenge I survived by the skin of my teeth.  I open with 1.d4, which has recently been my habit against higher-rated players."
2,d5,d7d5,rnbqkbnr/ppp1pppp/8/3p4/3P4/8/PPP1PPPP/RNBQKBNR w KQkq - 0 2,"Black replies with the Albin Counter-Gambit, a favourite of two of my colleagues at Didcot Chess Club. Despite several knockabout games at the club, I still don't know it."
3,c4,c2c4,rnbqkbnr/ppp1pppp/8/3p4/2PP4/8/PP2PPPP/RNBQKBNR b KQkq - 0 2,"Black replies with the Albin Counter-Gambit, a favourite of two of my colleagues at Didcot Chess Club. Despite several knockabout games at the club, I still don't know it."
4,e5,e7e5,rnbqkbnr/ppp2ppp/8/3pp3/2PP4/8/PP2PPPP/RNBQKBNR w KQkq - 0 3,"Black replies with the Albin Counter-Gambit, a favourite of two of my colleagues at Didcot Chess Club. Despite several knockabout games at the club, I still don't know it."
5,dxe5,d4e5,rnbqkbnr/ppp2ppp/8/3pP3/2P5/8/PP2PPPP/RNBQKBNR b KQkq - 0 3,This seems to be the principled response.
6,d4,d5d4,rnbqkbnr/ppp2ppp/8/4P3/2Pp4/8/PP2PPPP/RNBQKBNR w KQkq - 0 4,This pawn is designed to be a thorn in White's front.
7,Nf3,g1f3,rnbqkbnr/ppp2ppp/8/4P3/2Pp4/5N2/PP2PPPP/RNBQKB1R b KQkq - 1 4,"I hasten my development, attacking the pawn at the same time and inadvertently avoid the Lasker Trap: ""The careless move 4.e3? can lead to the Lasker Trap. After 4...Bb4+ 5.Bd2 dxe3 6.Bxb4?? is a blunder — 6...exf2+ 7.Ke2 fxg1=N+ and Black wins. The Lasker Trap is notable because it is rare to see an underpromotion as early as move 7."" ( http://en.wikipedia.org/wiki/Albin_Countergambit )"
8,c5,c7c5,rnbqkbnr/pp3ppp/8/2p1P3/2Pp4/5N2/PP2PPPP/RNBQKB1R w KQkq - 0 5,"Black bolsters the pawn, establishing a powerful centre that I'm going to have to play around."
9,g3,g2g3,rnbqkbnr/pp3ppp/8/2p1P3/2Pp4/5NP1/PP2PP1P/RNBQKB1R b KQkq - 0 5,"As mentioned, I decide to develop around the Black pawns, rather than challenge them directly with 5. e3 (The Lasker trap would no longer work because the pawn on c5 prevents 5...Bb4+).  Of 5. g3, Wikipedia says: ""Perhaps White's surest try for an advantage is to fianchetto his king bishop with 5.g3 followed by Bg2 and Nbd2. Black will often castle queenside. A typical continuation is 5.g3 Be6 6.Nbd2 Qd7 7.Bg2 0-0-0 8.0-0 Bh3."""
10,Be6,c8e6,rn1qkbnr/pp3ppp/4b3/2p1P3/2Pp4/5NP1/PP2PP1P/RNBQKB1R w KQkq - 1 6,"I diverge from Wikipedia's line, not that I was following it at the time (I'm just using it as reference for the annotation).  I think this move is in the Gameknot database, though.  It's consistent with my avoidance of 5. e3 and plan to fianchetto, defending the c4 pawn with another pawn."
11,b3,b2b3,rn1qkbnr/pp3ppp/4b3/2p1P3/2Pp4/1P3NP1/P3PP1P/RNBQKB1R b KQkq - 0 6,"I diverge from Wikipedia's line, not that I was following it at the time (I'm just using it as reference for the annotation).  I think this move is in the Gameknot database, though.  It's consistent with my avoidance of 5. e3 and plan to fianchetto, defending the c4 pawn with another pawn."
12,Nc6,b8c6,r2qkbnr/pp3ppp/2n1b3/2p1P3/2Pp4/1P3NP1/P3PP1P/RNBQKB1R w KQkq - 1 7,"Black continues to develop his Queenside, probably preparing Queenside castling."
13,Bg2,f1g2,r2qkbnr/pp3ppp/2n1b3/2p1P3/2Pp4/1P3NP1/P3PPBP/RNBQK2R b KQkq - 2 7,Counter-attacking Black's Q but depriving my QN of its best square.
14,Qa5+,d8a5,r3kbnr/pp3ppp/2n1b3/q1p1P3/2Pp4/1P3NP1/P3PPBP/RNBQK2R w KQkq - 3 8,Counter-attacking Black's Q but depriving my QN of its best square.
15,Bd2,c1d2,r3kbnr/pp3ppp/2n1b3/q1p1P3/2Pp4/1P3NP1/P2BPPBP/RN1QK2R b KQkq - 4 8,Counter-attacking Black's Q but depriving my QN of its best square.
16,Qc7,a5c7,r3kbnr/ppq2ppp/2n1b3/2p1P3/2Pp4/1P3NP1/P2BPPBP/RN1QK2R w KQkq - 5 9,Offering the e-pawn back for developing.
17,O-O,e1g1,r3kbnr/ppq2ppp/2n1b3/2p1P3/2Pp4/1P3NP1/P2BPPBP/RN1Q1RK1 b kq - 6 9,Offering the e-pawn back for developing.
18,O-O-O,e8c8,2kr1bnr/ppq2ppp/2n1b3/2p1P3/2Pp4/1P3NP1/P2BPPBP/RN1Q1RK1 w - - 7 10,Black ignores the offer to get his K to relative safety.
19,Bf4,d2f4,2kr1bnr/ppq2ppp/2n1b3/2p1P3/2Pp1B2/1P3NP1/P3PPBP/RN1Q1RK1 b - - 8 10,Now I defend the pawn to make room for my QN.
20,h6,h7h6,2kr1bnr/ppq2pp1/2n1b2p/2p1P3/2Pp1B2/1P3NP1/P3PPBP/RN1Q1RK1 w - - 0 11,Black prepares to push the B back again.
21,Na3,b1a3,2kr1bnr/ppq2pp1/2n1b2p/2p1P3/2Pp1B2/NP3NP1/P3PPBP/R2Q1RK1 b - - 1 11,"Now developing the N to d2 would have deprived the B of retreat squares, so it goes to a3, hoping to attack from b5."
22,a6,a7a6,2kr1bnr/1pq2pp1/p1n1b2p/2p1P3/2Pp1B2/NP3NP1/P3PPBP/R2Q1RK1 w - - 0 12,Black scotches that idea.
23,Nc2,a3c2,2kr1bnr/1pq2pp1/p1n1b2p/2p1P3/2Pp1B2/1P3NP1/P1N1PPBP/R2Q1RK1 b - - 1 12,"A knight on the rim is dim and he has no future over there, so he heads back towards the centre."
24,g5,g7g5,2kr1bnr/1pq2p2/p1n1b2p/2p1P1p1/2Pp1B2/1P3NP1/P1N1PPBP/R2Q1RK1 w - - 0 13,"As predicted, the B is pushed back"
25,Bd2,f4d2,2kr1bnr/1pq2p2/p1n1b2p/2p1P1p1/2Pp4/1P3NP1/P1NBPPBP/R2Q1RK1 b - - 1 13,and Black finally wins back his pawn.
26,Nxe5,c6e5,2kr1bnr/1pq2p2/p3b2p/2p1n1p1/2Pp4/1P3NP1/P1NBPPBP/R2Q1RK1 w - - 0 14,and Black finally wins back his pawn.
27,Qe1,d1e1,2kr1bnr/1pq2p2/p3b2p/2p1n1p1/2Pp4/1P3NP1/P1NBPPBP/R3QRK1 b - - 1 14,"Threatening to skewer Q and R from a5, a threat easily parried, but it also gets my Q off the d-file, which Black has occupied with a Rook."
