N_move,Standard_notation,UCI_notation,FEN_notation,Comment
1,e4,e2e4,rnbqkbnr/pppppppp/8/8/4P3/8/PPPP1PPP/RNBQKBNR b KQkq - 0 1,"In reply to the king's pawn opening, black plays the Sicilian defence."
2,c5,c7c5,rnbqkbnr/pp1ppppp/8/2p5/4P3/8/PPPP1PPP/RNBQKBNR w KQkq - 0 2,"In reply to the king's pawn opening, black plays the Sicilian defence."
3,d4,d2d4,rnbqkbnr/pp1ppppp/8/2p5/3PP3/8/PPP2PPP/RNBQKBNR b KQkq - 0 2,"Although not so powerful (as I learned later), white plays the Morra gambit."
4,cxd4,c5d4,rnbqkbnr/pp1ppppp/8/8/3pP3/8/PPP2PPP/RNBQKBNR w KQkq - 0 3,Black accepts the gambit.
5,c3,c2c3,rnbqkbnr/pp1ppppp/8/8/3pP3/2P5/PP3PPP/RNBQKBNR b KQkq - 0 3,Black accepts the gambit.
6,dxc3,d4c3,rnbqkbnr/pp1ppppp/8/8/4P3/2p5/PP3PPP/RNBQKBNR w KQkq - 0 4,Black accepts the gambit.
7,Nxc3,b1c3,rnbqkbnr/pp1ppppp/8/8/4P3/2N5/PP3PPP/R1BQKBNR b KQkq - 0 4,White sacrifices a pawn but gains control of the centre and develops attack opportunities.
8,Nc6,b8c6,r1bqkbnr/pp1ppppp/2n5/8/4P3/2N5/PP3PPP/R1BQKBNR w KQkq - 1 5,"A form of Siberian variation is played, which could later develop in the famous ""Siberian Trap"" (where black captures white's queen), but otherwise still with potentially a better game for black."
9,Bc4,f1c4,r1bqkbnr/pp1ppppp/2n5/8/2B1P3/2N5/PP3PPP/R1BQK1NR b KQkq - 2 5,"A form of Siberian variation is played, which could later develop in the famous ""Siberian Trap"" (where black captures white's queen), but otherwise still with potentially a better game for black."
10,e6,e7e6,r1bqkbnr/pp1p1ppp/2n1p3/8/2B1P3/2N5/PP3PPP/R1BQK1NR w KQkq - 0 6,"A form of Siberian variation is played, which could later develop in the famous ""Siberian Trap"" (where black captures white's queen), but otherwise still with potentially a better game for black."
11,Nf3,g1f3,r1bqkbnr/pp1p1ppp/2n1p3/8/2B1P3/2N2N2/PP3PPP/R1BQK2R b KQkq - 1 6,"A form of Siberian variation is played, which could later develop in the famous ""Siberian Trap"" (where black captures white's queen), but otherwise still with potentially a better game for black."
12,Bb4,f8b4,r1bqk1nr/pp1p1ppp/2n1p3/8/1bB1P3/2N2N2/PP3PPP/R1BQK2R w KQkq - 2 7,"Black pins the knight, but does not threaten anything significantly (a Bxc3 exchange would leave black's knight in c6 with even less mobility)."
13,O-O,e1g1,r1bqk1nr/pp1p1ppp/2n1p3/8/1bB1P3/2N2N2/PP3PPP/R1BQ1RK1 b kq - 3 7,White naturally castle and the knight is free to move.
14,Nge7,g8e7,r1bqk2r/pp1pnppp/2n1p3/8/1bB1P3/2N2N2/PP3PPP/R1BQ1RK1 w kq - 4 8,"Black reckons it's time to castle as well, though Ne7 leaves the knight with few options to further develop."
15,Be3,c1e3,r1bqk2r/pp1pnppp/2n1p3/8/1bB1P3/2N1BN2/PP3PPP/R2Q1RK1 b kq - 5 8,White pre-empts a possible Qb6 development.
16,O-O,e8g8,r1bq1rk1/pp1pnppp/2n1p3/8/1bB1P3/2N1BN2/PP3PPP/R2Q1RK1 w - - 6 9,"As expected, castling."
17,a3,a2a3,r1bq1rk1/pp1pnppp/2n1p3/8/1bB1P3/P1N1BN2/1P3PPP/R2Q1RK1 b - - 0 9,White begins to harass.
18,Bxc3,b4c3,r1bq1rk1/pp1pnppp/2n1p3/8/2B1P3/P1b1BN2/1P3PPP/R2Q1RK1 w - - 0 10,Preventing white's Bc5 attack.
19,bxc3,b2c3,r1bq1rk1/pp1pnppp/2n1p3/8/2B1P3/P1P1BN2/5PPP/R2Q1RK1 b - - 0 10,Preventing white's Bc5 attack.
20,b6,b7b6,r1bq1rk1/p2pnppp/1pn1p3/8/2B1P3/P1P1BN2/5PPP/R2Q1RK1 w - - 0 11,Preventing white's Bc5 attack.
21,Qd3,d1d3,r1bq1rk1/p2pnppp/1pn1p3/8/2B1P3/P1PQBN2/5PPP/R4RK1 b - - 1 11,White brings the queen into the game and contemplates a potential attack on king's side.
22,Bb7,c8b7,r2q1rk1/pb1pnppp/1pn1p3/8/2B1P3/P1PQBN2/5PPP/R4RK1 w - - 2 12,"Black needs to start developing the game, but does not have too many options."
23,Rfd1,f1d1,r2q1rk1/pb1pnppp/1pn1p3/8/2B1P3/P1PQBN2/5PPP/R2R2K1 b - - 3 12,"White aims to exchange queens, while capturing a pawn and leaving the rook in an uncomfortable setting for black."
24,Bc8,b7c8,r1bq1rk1/p2pnppp/1pn1p3/8/2B1P3/P1PQBN2/5PPP/R2R2K1 w - - 4 13,"Black defends the weak pawn, but has wasted a move."
25,e5,e4e5,r1bq1rk1/p2pnppp/1pn1p3/4P3/2B5/P1PQBN2/5PPP/R2R2K1 b - - 0 13,"Pushing the pawn to increase the pressure, while opening the white diagonal for the queen, in view of a deadly attack."
26,Nf5,e7f5,r1bq1rk1/p2p1ppp/1pn1p3/4Pn2/2B5/P1PQBN2/5PPP/R2R2K1 w - - 1 14,Black has to block and the knight move is his best option. (Pushing the f7 pawn would have weaken the defence of the king).
27,Bg5,e3g5,r1bq1rk1/p2p1ppp/1pn1p3/4PnB1/2B5/P1PQ1N2/5PPP/R2R2K1 b - - 2 14,"But that's exactly what white wants, thus attacking the queen."
28,Qc7,d8c7,r1b2rk1/p1qp1ppp/1pn1p3/4PnB1/2B5/P1PQ1N2/5PPP/R2R2K1 w - - 3 15,Black secures the queen while seeking to annihilate white's offensive by capturing the pawn in e5. NB. white's bishop remains problematic.
