N_move,Standard_notation,UCI_notation,FEN_notation,Comment
1,e4,e2e4,rnbqkbnr/pppppppp/8/8/4P3/8/PPPP1PPP/RNBQKBNR b KQkq - 0 1,A very strange opening. It's the beginning of the Hippopotamus Defence.
2,Nh6,g8h6,rnbqkb1r/pppppppp/7n/8/4P3/8/PPPP1PPP/RNBQKBNR w KQkq - 1 2,A very strange opening. It's the beginning of the Hippopotamus Defence.
3,d4,d2d4,rnbqkb1r/pppppppp/7n/8/3PP3/8/PPP2PPP/RNBQKBNR b KQkq - 0 2,Attacks the knight.
4,f5,f7f5,rnbqkb1r/ppppp1pp/7n/5p2/3PP3/8/PPP2PPP/RNBQKBNR w KQkq - 0 3,Now the knight is lost.
5,Bxh6,c1h6,rnbqkb1r/ppppp1pp/7B/5p2/3PP3/8/PPP2PPP/RN1QKBNR b KQkq - 0 3,gxh6 loses the game.
6,gxh6,g7h6,rnbqkb1r/ppppp2p/7p/5p2/3PP3/8/PPP2PPP/RN1QKBNR w KQkq - 0 4,"But of course, that's what was played."
7,Qh5#,d1h5,rnbqkb1r/ppppp2p/7p/5p1Q/3PP3/8/PPP2PPP/RN2KBNR b KQkq - 1 4,"Ta-Da!

Try some of my puzzles."
