N_move,Standard_notation,UCI_notation,FEN_notation,Comment
1,Nf3,g1f3,rnbqkbnr/pppppppp/8/8/8/5N2/PPPPPPPP/RNBQKB1R b KQkq - 1 1,"The Reti opening. As in the Queen's Gambit, White is trying to remove Black's QP and thereby lessen his control over e4."
2,d5,d7d5,rnbqkbnr/ppp1pppp/8/3p4/8/5N2/PPPPPPPP/RNBQKB1R w KQkq - 0 2,"The Reti opening. As in the Queen's Gambit, White is trying to remove Black's QP and thereby lessen his control over e4."
3,c4,c2c4,rnbqkbnr/ppp1pppp/8/3p4/2P5/5N2/PP1PPPPP/RNBQKB1R b KQkq - 0 2,"The Reti opening. As in the Queen's Gambit, White is trying to remove Black's QP and thereby lessen his control over e4."
4,d4,d5d4,rnbqkbnr/ppp1pppp/8/8/2Pp4/5N2/PP1PPPPP/RNBQKB1R w KQkq - 0 3,"The Main Line, but other moves are playable: 2...dxc4, 2...c6, 2...e6."
5,d3,d2d3,rnbqkbnr/ppp1pppp/8/8/2Pp4/3P1N2/PP2PPPP/RNBQKB1R b KQkq - 0 3,"A gambit, designed to weaken the pawn on d4, but the more conservative 4.g3 is probably better."
6,c5,c7c5,rnbqkbnr/pp2pppp/8/2p5/2Pp4/3P1N2/PP2PPPP/RNBQKB1R w KQkq - 0 4,"A gambit, designed to weaken the pawn on d4, but the more conservative 4.g3 is probably better."
7,b4,b2b4,rnbqkbnr/pp2pppp/8/2p5/1PPp4/3P1N2/P3PPPP/RNBQKB1R b KQkq - 0 4,"A gambit, designed to weaken the pawn on d4, but the more conservative 4.g3 is probably better."
8,cxb4,c5b4,rnbqkbnr/pp2pppp/8/8/1pPp4/3P1N2/P3PPPP/RNBQKB1R w KQkq - 0 5,Hoping you will capture again and enable him to develop one of his pieces.
9,a3,a2a3,rnbqkbnr/pp2pppp/8/8/1pPp4/P2P1N2/4PPPP/RNBQKB1R b KQkq - 0 5,Hoping you will capture again and enable him to develop one of his pieces.
10,Qa5,d8a5,rnb1kbnr/pp2pppp/8/q7/1pPp4/P2P1N2/4PPPP/RNBQKB1R w KQkq - 1 6,"You did right not to capture, but this gives up the pawn on d4 for nothing. Both 5...e6 and 5...b3 have yielded good results."
11,Bd2,c1d2,rnb1kbnr/pp2pppp/8/q7/1pPp4/P2P1N2/3BPPPP/RN1QKB1R b KQkq - 2 6,White should have just played 6.Nxd4.
12,e6,e7e6,rnb1kbnr/pp3ppp/4p3/q7/1pPp4/P2P1N2/3BPPPP/RN1QKB1R w KQkq - 0 7,"6...Nc6, defending both pawns, is better (or you could play 6...e5)."
13,Nxd4,f3d4,rnb1kbnr/pp3ppp/4p3/q7/1pPN4/P2P4/3BPPPP/RN1QKB1R b KQkq - 0 7,"Material is level again, but White has control of the centre and Black can't do much about it due to the absence of his c and d pawns."
14,Qe5,a5e5,rnb1kbnr/pp3ppp/4p3/4q3/1pPN4/P2P4/3BPPPP/RN1QKB1R w KQkq - 1 8,The best move.
15,Nb5,d4b5,rnb1kbnr/pp3ppp/4p3/1N2q3/1pP5/P2P4/3BPPPP/RN1QKB1R b KQkq - 2 8,The simple 8.Nb3 was better. I don't think he looked far enough ahead.
16,Qxa1,e5a1,rnb1kbnr/pp3ppp/4p3/1N6/1pP5/P2P4/3BPPPP/qN1QKB1R w Kkq - 0 9,"White has regained his rook, but how does he extricate his knight?"
17,Nc7+,b5c7,rnb1kbnr/ppN2ppp/4p3/8/1pP5/P2P4/3BPPPP/qN1QKB1R b Kkq - 1 9,"White has regained his rook, but how does he extricate his knight?"
18,Kd8,e8d8,rnbk1bnr/ppN2ppp/4p3/8/1pP5/P2P4/3BPPPP/qN1QKB1R w K - 2 10,"White has regained his rook, but how does he extricate his knight?"
19,Nxa8,c7a8,Nnbk1bnr/pp3ppp/4p3/8/1pP5/P2P4/3BPPPP/qN1QKB1R b K - 0 10,"White has regained his rook, but how does he extricate his knight?"
20,bxa3,b4a3,Nnbk1bnr/pp3ppp/4p3/8/2P5/p2P4/3BPPPP/qN1QKB1R w K - 0 11,Black now has a very dangerous pawn.
21,Bf4,d2f4,Nnbk1bnr/pp3ppp/4p3/8/2P2B2/p2P4/4PPPP/qN1QKB1R b K - 1 11,"White tries to extricate his knight, but it was more important to counter the threat of the pawn."
22,Bb4+,f8b4,Nnbk2nr/pp3ppp/4p3/8/1bP2B2/p2P4/4PPPP/qN1QKB1R w K - 2 12,"The immediate 11...e2 is best, but this also wins."
23,Nd2,b1d2,Nnbk2nr/pp3ppp/4p3/8/1bP2B2/p2P4/3NPPPP/q2QKB1R b K - 3 12,12...Qb2 was better.
24,Qxd1+,a1d1,Nnbk2nr/pp3ppp/4p3/8/1bP2B2/p2P4/3NPPPP/3qKB1R w K - 0 13,12...Qb2 was better.
25,Kxd1,e1d1,Nnbk2nr/pp3ppp/4p3/8/1bP2B2/p2P4/3NPPPP/3K1B1R b - - 0 13,15.Bb2 would have made it more difficult for you.
26,a2,a3a2,Nnbk2nr/pp3ppp/4p3/8/1bP2B2/3P4/p2NPPPP/3K1B1R w - - 0 14,15.Bb2 would have made it more difficult for you.
27,Be5,f4e5,Nnbk2nr/pp3ppp/4p3/4B3/1bP5/3P4/p2NPPPP/3K1B1R b - - 1 14,15.Bb2 would have made it more difficult for you.
28,Nc6,b8c6,N1bk2nr/pp3ppp/2n1p3/4B3/1bP5/3P4/p2NPPPP/3K1B1R w - - 2 15,15.Bb2 would have made it more difficult for you.
29,Bxg7,e5g7,N1bk2nr/pp3pBp/2n1p3/8/1bP5/3P4/p2NPPPP/3K1B1R b - - 0 15,15.Bb2 would have made it more difficult for you.
30,f6,f7f6,N1bk2nr/pp4Bp/2n1pp2/8/1bP5/3P4/p2NPPPP/3K1B1R w - - 0 16,Well played!
31,Nb3,d2b3,N1bk2nr/pp4Bp/2n1pp2/8/1bP5/1N1P4/p3PPPP/3K1B1R b - - 1 16,Well played!
32,Nd4,c6d4,N1bk2nr/pp4Bp/4pp2/8/1bPn4/1N1P4/p3PPPP/3K1B1R w - - 2 17,Well played!
