N_move,Standard_notation,UCI_notation,FEN_notation,Comment
1,e4,e2e4,rnbqkbnr/pppppppp/8/8/4P3/8/PPPP1PPP/RNBQKBNR b KQkq - 0 1,"the Ruy Lopez, probably one of the most analyzed opening systems in the world; played for the first time in my life..."
2,e5,e7e5,rnbqkbnr/pppp1ppp/8/4p3/4P3/8/PPPP1PPP/RNBQKBNR w KQkq - 0 2,"the Ruy Lopez, probably one of the most analyzed opening systems in the world; played for the first time in my life..."
3,Nf3,g1f3,rnbqkbnr/pppp1ppp/8/4p3/4P3/5N2/PPPP1PPP/RNBQKB1R b KQkq - 1 2,"the Ruy Lopez, probably one of the most analyzed opening systems in the world; played for the first time in my life..."
4,Nc6,b8c6,r1bqkbnr/pppp1ppp/2n5/4p3/4P3/5N2/PPPP1PPP/RNBQKB1R w KQkq - 2 3,"the Ruy Lopez, probably one of the most analyzed opening systems in the world; played for the first time in my life..."
5,Bb5,f1b5,r1bqkbnr/pppp1ppp/2n5/1B2p3/4P3/5N2/PPPP1PPP/RNBQK2R b KQkq - 3 3,"the Ruy Lopez, probably one of the most analyzed opening systems in the world; played for the first time in my life..."
6,a6,a7a6,r1bqkbnr/1ppp1ppp/p1n5/1B2p3/4P3/5N2/PPPP1PPP/RNBQK2R w KQkq - 0 4,"the usual and strongest reply...  other options are the Cordel variation Bc5, c3, Nf6, d4 - reminiscent to the Italian Party - or the Bird defense Nd4, Nxd4, exd4, 0-0, c6, Bc4, Nf6, bringing us back to Italian lines again..."
7,Ba4,b5a4,r1bqkbnr/1ppp1ppp/p1n5/4p3/B3P3/5N2/PPPP1PPP/RNBQK2R b KQkq - 1 4,"again the usual and strongest reply... another option is the Exchange variation Bxc6, dxc6, 0-0; brought to life again by Fischer at Havana 1966..."
8,Nf6,g8f6,r1bqkb1r/1ppp1ppp/p1n2n2/4p3/B3P3/5N2/PPPP1PPP/RNBQK2R w KQkq - 2 5,"business as usual; White could also consider the ancient Steinitz favorite d3, which is a bit slow, but very playable for White; which again Fischer showed us on several occasions in tournament play... we will try this on a next occasion..."
9,O-O,e1g1,r1bqkb1r/1ppp1ppp/p1n2n2/4p3/B3P3/5N2/PPPP1PPP/RNBQ1RK1 b kq - 3 5,"business as usual; White could also consider the ancient Steinitz favorite d3, which is a bit slow, but very playable for White; which again Fischer showed us on several occasions in tournament play... we will try this on a next occasion..."
10,b5,b7b5,r1bqkb1r/2pp1ppp/p1n2n2/1p2p3/B3P3/5N2/PPPP1PPP/RNBQ1RK1 w kq - 0 6,"from here, Black has usually three choices; a) open defense: Nxe4, d4, b5, Bb3, d5, dxe5, Be6, c3; b) closed defense: Be7, Re1, b5, Bb3, d6, c3, 0-0; c) d6 defense: d6, Re1, b5, Bb3, Na5, d4, Nxb3... in this game, Black clearly hasn't decided yet..."
11,Bb3,a4b3,r1bqkb1r/2pp1ppp/p1n2n2/1p2p3/4P3/1B3N2/PPPP1PPP/RNBQ1RK1 b kq - 1 6,"Black clearly ran out of theory already, and is trying to make a futile point about e4; giving White time for additional development..."
12,Bb7,c8b7,r2qkb1r/1bpp1ppp/p1n2n2/1p2p3/4P3/1B3N2/PPPP1PPP/RNBQ1RK1 w kq - 2 7,"Black clearly ran out of theory already, and is trying to make a futile point about e4; giving White time for additional development..."
13,Nc3,b1c3,r2qkb1r/1bpp1ppp/p1n2n2/1p2p3/4P3/1BN2N2/PPPP1PPP/R1BQ1RK1 b kq - 3 7,"introducing Nd5 into the mixture... another strong option here is the usually played (Fischer) a4, to release Bb3, but Nc3 makes this all the more stronger after Bb7; plus: e4 is suddenly covered..."
14,Be7,f8e7,r2qk2r/1bppbppp/p1n2n2/1p2p3/4P3/1BN2N2/PPPP1PPP/R1BQ1RK1 w kq - 4 8,"Black closes his defenses; since we are preparing Nd5, we pass on a direct d4, exd4, Nxd4, Nxd4, Qxd4, c5!, Qe3, with too much complications; this old Steinitz move covers e4 after Nd5..."
15,d3,d2d3,r2qk2r/1bppbppp/p1n2n2/1p2p3/4P3/1BNP1N2/PPP2PPP/R1BQ1RK1 b kq - 0 8,"Black closes his defenses; since we are preparing Nd5, we pass on a direct d4, exd4, Nxd4, Nxd4, Qxd4, c5!, Qe3, with too much complications; this old Steinitz move covers e4 after Nd5..."
16,O-O,e8g8,r2q1rk1/1bppbppp/p1n2n2/1p2p3/4P3/1BNP1N2/PPP2PPP/R1BQ1RK1 w - - 1 9,"a clever addition, if I may say so myself; keeping an eye on b4 and a5 after Nd5..."
17,Bd2,c1d2,r2q1rk1/1bppbppp/p1n2n2/1p2p3/4P3/1BNP1N2/PPPB1PPP/R2Q1RK1 b - - 2 9,"a clever addition, if I may say so myself; keeping an eye on b4 and a5 after Nd5..."
18,d6,d7d6,r2q1rk1/1bp1bppp/p1np1n2/1p2p3/4P3/1BNP1N2/PPPB1PPP/R2Q1RK1 w - - 0 10,"Black wants to complete his development; best is first Nd4, Nxd4 (Nxe5, b4!, Ne2, Nxb3, axb3, d5! (ruining my plans), exd5, Qxd5), exd4, to simplify before Nd5 hits..."
19,Nd5,c3d5,r2q1rk1/1bp1bppp/p1np1n2/1p1Np3/4P3/1B1P1N2/PPPB1PPP/R2Q1RK1 b - - 1 10,"now or never; this will clear a path either for c4 or d4, after an additional c3..."
20,Nxd5,f6d5,r2q1rk1/1bp1bppp/p1np4/1p1np3/4P3/1B1P1N2/PPPB1PPP/R2Q1RK1 w - - 0 11,"not the best: Black should be preparing Nd8 (Na5 is impossible) to trade Bd5, and prepare c6 or c5; Qd7 (solves it rightaway) or Qc8 (supports c6/c5) were options..."
21,Bxd5,b3d5,r2q1rk1/1bp1bppp/p1np4/1p1Bp3/4P3/3P1N2/PPPB1PPP/R2Q1RK1 b - - 0 11,"not the best: Black should be preparing Nd8 (Na5 is impossible) to trade Bd5, and prepare c6 or c5; Qd7 (solves it rightaway) or Qc8 (supports c6/c5) were options..."
22,Bf6,e7f6,r2q1rk1/1bp2ppp/p1np1b2/1p1Bp3/4P3/3P1N2/PPPB1PPP/R2Q1RK1 w - - 1 12,"not the best: Black should be preparing Nd8 (Na5 is impossible) to trade Bd5, and prepare c6 or c5; Qd7 (solves it rightaway) or Qc8 (supports c6/c5) were options..."
23,Be3,d2e3,r2q1rk1/1bp2ppp/p1np1b2/1p1Bp3/4P3/3PBN2/PPP2PPP/R2Q1RK1 b - - 2 12,"we need not protect a5 anymore, since Bb3 has been replaced, and cover the all important c5; after Na5, a4!, Bxd5, exd5, b4, Nd2, c6, Qf3, followed by c3 or c4, White has the better of the play... this is preventing Nd4, and preparing d4..."
24,Rb8,a8b8,1r1q1rk1/1bp2ppp/p1np1b2/1p1Bp3/4P3/3PBN2/PPP2PPP/R2Q1RK1 w - - 3 13,"not better, than the above variation for Black; this might well be the losing move already..."
25,c3,c2c3,1r1q1rk1/1bp2ppp/p1np1b2/1p1Bp3/4P3/2PPBN2/PP3PPP/R2Q1RK1 b - - 0 13,"still theory; enforcing d4, and preventing Nb4..."
26,Na5,c6a5,1r1q1rk1/1bp2ppp/p2p1b2/np1Bp3/4P3/2PPBN2/PP3PPP/R2Q1RK1 w - - 1 14,"underestimating the situation; needed was a way to put the Knight elsewhere, like Qd7, followed by Nd8; this will soon go sour..."
27,a4,a2a4,1r1q1rk1/1bp2ppp/p2p1b2/np1Bp3/P3P3/2PPBN2/1P3PPP/R2Q1RK1 b - - 0 14,"this move is what this variation is all about, and worth waiting for; now, Bd5 might even retreat to a2... needless to say, that also axb5 is a big problem; after c6, Ba2, threatening b4... Blacks' Queens' wing is about to fall apart, thanks to Rb8..."
28,Bxd5,b7d5,1r1q1rk1/2p2ppp/p2p1b2/np1bp3/P3P3/2PPBN2/1P3PPP/R2Q1RK1 w - - 0 15,not better than above variation; Black needs to find a way to cover for Na5...
29,exd5,e4d5,1r1q1rk1/2p2ppp/p2p1b2/np1Pp3/P7/2PPBN2/1P3PPP/R2Q1RK1 b - - 0 15,"long overdue and a clear mistake at this point; last option was c5 (covers Na5), axb5, axb5, Nd2 (against e4, supporting c4), Ra8..."
30,Qd7,d8d7,1r3rk1/2pq1ppp/p2p1b2/np1Pp3/P7/2PPBN2/1P3PPP/R2Q1RK1 w - - 1 16,"long overdue and a clear mistake at this point; last option was c5 (covers Na5), axb5, axb5, Nd2 (against e4, supporting c4), Ra8..."
31,axb5,a4b5,1r3rk1/2pq1ppp/p2p1b2/nP1Pp3/8/2PPBN2/1P3PPP/R2Q1RK1 b - - 0 16,"no other option left; (also) after Rxb5, c4, and after e4, Nd2, leaves Na5 lost... after Nb7, bxa6, Nc5, b4, e4, bxc5, exf3, Qxf3, Bxc3, Ra3, Bb4, c6!, Black can start worrying..."
32,Qxb5,d7b5,1r3rk1/2p2ppp/p2p1b2/nq1Pp3/8/2PPBN2/1P3PPP/R2Q1RK1 w - - 0 17,"no other option left; (also) after Rxb5, c4, and after e4, Nd2, leaves Na5 lost... after Nb7, bxa6, Nc5, b4, e4, bxc5, exf3, Qxf3, Bxc3, Ra3, Bb4, c6!, Black can start worrying..."
