N_move,Standard_notation,UCI_notation,FEN_notation,Comment
1,Nf3,g1f3,rnbqkbnr/pppppppp/8/8/8/5N2/PPPPPPPP/RNBQKB1R b KQkq - 1 1,"This is the Queen's Indian Defense d5-pawn sac line.  A nice positional crush up to the sacrificial finish.  Feel free to leave comments, especially if you're going to give it 1 star!!!"
2,Nf6,g8f6,rnbqkb1r/pppppppp/5n2/8/8/5N2/PPPPPPPP/RNBQKB1R w KQkq - 2 2,"6. Nc3 0-0; 7. Re1! is more topical and now 7...Ne4, 7...c5, or 7...d5 are possible."
3,c4,c2c4,rnbqkb1r/pppppppp/5n2/8/2P5/5N2/PP1PPPPP/RNBQKB1R b KQkq - 0 2,"6. Nc3 0-0; 7. Re1! is more topical and now 7...Ne4, 7...c5, or 7...d5 are possible."
4,b6,b7b6,rnbqkb1r/p1pppppp/1p3n2/8/2P5/5N2/PP1PPPPP/RNBQKB1R w KQkq - 0 3,"6. Nc3 0-0; 7. Re1! is more topical and now 7...Ne4, 7...c5, or 7...d5 are possible."
5,g3,g2g3,rnbqkb1r/p1pppppp/1p3n2/8/2P5/5NP1/PP1PPP1P/RNBQKB1R b KQkq - 0 3,"6. Nc3 0-0; 7. Re1! is more topical and now 7...Ne4, 7...c5, or 7...d5 are possible."
6,Bb7,c8b7,rn1qkb1r/pbpppppp/1p3n2/8/2P5/5NP1/PP1PPP1P/RNBQKB1R w KQkq - 1 4,"6. Nc3 0-0; 7. Re1! is more topical and now 7...Ne4, 7...c5, or 7...d5 are possible."
7,Bg2,f1g2,rn1qkb1r/pbpppppp/1p3n2/8/2P5/5NP1/PP1PPPBP/RNBQK2R b KQkq - 2 4,"6. Nc3 0-0; 7. Re1! is more topical and now 7...Ne4, 7...c5, or 7...d5 are possible."
8,e6,e7e6,rn1qkb1r/pbpp1ppp/1p2pn2/8/2P5/5NP1/PP1PPPBP/RNBQK2R w KQkq - 0 5,"6. Nc3 0-0; 7. Re1! is more topical and now 7...Ne4, 7...c5, or 7...d5 are possible."
9,O-O,e1g1,rn1qkb1r/pbpp1ppp/1p2pn2/8/2P5/5NP1/PP1PPPBP/RNBQ1RK1 b kq - 1 5,"6. Nc3 0-0; 7. Re1! is more topical and now 7...Ne4, 7...c5, or 7...d5 are possible."
10,Be7,f8e7,rn1qk2r/pbppbppp/1p2pn2/8/2P5/5NP1/PP1PPPBP/RNBQ1RK1 w kq - 2 6,"6. Nc3 0-0; 7. Re1! is more topical and now 7...Ne4, 7...c5, or 7...d5 are possible."
11,d4,d2d4,rn1qk2r/pbppbppp/1p2pn2/8/2PP4/5NP1/PP2PPBP/RNBQ1RK1 b kq - 0 6,"6. Nc3 0-0; 7. Re1! is more topical and now 7...Ne4, 7...c5, or 7...d5 are possible."
12,c5,c7c5,rn1qk2r/pb1pbppp/1p2pn2/2p5/2PP4/5NP1/PP2PPBP/RNBQ1RK1 w kq - 0 7,"It's difficult to believe that such a seemingly natural move is a mistake, however, White's next move not only cramps the Black position, but gives White dangerous initiative."
13,d5,d4d5,rn1qk2r/pb1pbppp/1p2pn2/2pP4/2P5/5NP1/PP2PPBP/RNBQ1RK1 b kq - 0 7,"This temporary pawn sacrifice can also occur when Black plays 6...0-0; 7. d5 ed; 8. Nh4 c6!?, with roughly equal chances.  With the c-pawn on c5 the White pawn center will permanently cramp the Black position."
14,exd5,e6d5,rn1qk2r/pb1pbppp/1p3n2/2pp4/2P5/5NP1/PP2PPBP/RNBQ1RK1 w kq - 0 8,"A typical theme in the QID, white exploits the pin on the h1-a8 diagonal to win back the pawn.  The h4-knight also prepares to sink in on f5 with threats against the Black king."
15,Nh4,f3h4,rn1qk2r/pb1pbppp/1p3n2/2pp4/2P4N/6P1/PP2PPBP/RNBQ1RK1 b kq - 1 8,"A typical theme in the QID, white exploits the pin on the h1-a8 diagonal to win back the pawn.  The h4-knight also prepares to sink in on f5 with threats against the Black king."
16,d6,d7d6,rn1qk2r/pb2bppp/1p1p1n2/2pp4/2P4N/6P1/PP2PPBP/RNBQ1RK1 w kq - 0 9,Another idea is 8...Na6 followed by ...Nc7.
17,cxd5,c4d5,rn1qk2r/pb2bppp/1p1p1n2/2pP4/7N/6P1/PP2PPBP/RNBQ1RK1 b kq - 0 9,"Black chooses the more central deployment of the knight, retaining the possibility of dropping in on e5."
18,Nbd7,b8d7,r2qk2r/pb1nbppp/1p1p1n2/2pP4/7N/6P1/PP2PPBP/RNBQ1RK1 w kq - 1 10,"Black chooses the more central deployment of the knight, retaining the possibility of dropping in on e5."
19,Nc3,b1c3,r2qk2r/pb1nbppp/1p1p1n2/2pP4/7N/2N3P1/PP2PPBP/R1BQ1RK1 b kq - 2 10,"Preventing any ""comeback"" tactics on the d5-pawn due to the queen and bishop battery on the h4-d8 diagonal."
20,O-O,e8g8,r2q1rk1/pb1nbppp/1p1p1n2/2pP4/7N/2N3P1/PP2PPBP/R1BQ1RK1 w - - 3 11,"I was in no rush to play e4 and want to meet ...g6 with Nh6 , keeping the Black pieces awkwardly placed."
21,Nf5,h4f5,r2q1rk1/pb1nbppp/1p1p1n2/2pP1N2/8/2N3P1/PP2PPBP/R1BQ1RK1 b - - 4 11,"I was in no rush to play e4 and want to meet ...g6 with Nh6 , keeping the Black pieces awkwardly placed."
22,Ne5,d7e5,r2q1rk1/pb2bppp/1p1p1n2/2pPnN2/8/2N3P1/PP2PPBP/R1BQ1RK1 w - - 5 12,"This move turns out to be not so good, as Black gets some tempi by kicking it around."
23,Bg5,c1g5,r2q1rk1/pb2bppp/1p1p1n2/2pPnNB1/8/2N3P1/PP2PPBP/R2Q1RK1 b - - 6 12,"This move turns out to be not so good, as Black gets some tempi by kicking it around."
24,h6,h7h6,r2q1rk1/pb2bpp1/1p1p1n1p/2pPnNB1/8/2N3P1/PP2PPBP/R2Q1RK1 w - - 0 13,"Then again, h6 does become the scene of a later sacrifice!"
25,Bf4,g5f4,r2q1rk1/pb2bpp1/1p1p1n1p/2pPnN2/5B2/2N3P1/PP2PPBP/R2Q1RK1 b - - 1 13,"Then again, h6 does become the scene of a later sacrifice!"
26,Ng6,e5g6,r2q1rk1/pb2bpp1/1p1p1nnp/2pP1N2/5B2/2N3P1/PP2PPBP/R2Q1RK1 w - - 2 14,"Operating on the premise that any exchanges favor the cramped side, I preserve the bishop for later deployment.  It also seems that the Black knight is better on e5 than on g6, but I could be wrong."
27,Bd2,f4d2,r2q1rk1/pb2bpp1/1p1p1nnp/2pP1N2/8/2N3P1/PP1BPPBP/R2Q1RK1 b - - 3 14,"Operating on the premise that any exchanges favor the cramped side, I preserve the bishop for later deployment.  It also seems that the Black knight is better on e5 than on g6, but I could be wrong."
28,Re8,f8e8,r2qr1k1/pb2bpp1/1p1p1nnp/2pP1N2/8/2N3P1/PP1BPPBP/R2Q1RK1 w - - 4 15,Preparing the centralize the rooks and push the e- and f-pawns.
29,Qc2,d1c2,r2qr1k1/pb2bpp1/1p1p1nnp/2pP1N2/8/2N3P1/PPQBPPBP/R4RK1 b - - 5 15,Preparing the centralize the rooks and push the e- and f-pawns.
30,Bf8,e7f8,r2qrbk1/pb3pp1/1p1p1nnp/2pP1N2/8/2N3P1/PPQBPPBP/R4RK1 w - - 6 16,It seems that Black has made the most of his reorganization.  White still has the advantage due to the static space advantage and better placed pieces.
31,Rfe1,f1e1,r2qrbk1/pb3pp1/1p1p1nnp/2pP1N2/8/2N3P1/PPQBPPBP/R3R1K1 b - - 7 16,I was entertaining the idea of Ra-e1 also.
32,Qd7,d8d7,r3rbk1/pb1q1pp1/1p1p1nnp/2pP1N2/8/2N3P1/PPQBPPBP/R3R1K1 w - - 8 17,"Black continues to unravel, all would be well, if Black could play ...d5."
33,Rac1,a1c1,r3rbk1/pb1q1pp1/1p1p1nnp/2pP1N2/8/2N3P1/PPQBPPBP/2R1R1K1 b - - 9 17,"Not so sure about this move, as I was intending Rad1, but at the last minute I had some idea about slowing down Black's queenside play as I was sure ...b5 and ...c4 was sure to come."
34,b5,b6b5,r3rbk1/pb1q1pp1/3p1nnp/1ppP1N2/8/2N3P1/PPQBPPBP/2R1R1K1 w - - 0 18,Black's only feasible plan of expansion.
35,e4,e2e4,r3rbk1/pb1q1pp1/3p1nnp/1ppP1N2/4P3/2N3P1/PPQB1PBP/2R1R1K1 b - - 0 18,Now it's a race!
36,b4,b5b4,r3rbk1/pb1q1pp1/3p1nnp/2pP1N2/1p2P3/2N3P1/PPQB1PBP/2R1R1K1 w - - 0 19,The knight wants to go to c4 via e3.
37,Nd1,c3d1,r3rbk1/pb1q1pp1/3p1nnp/2pP1N2/1p2P3/6P1/PPQB1PBP/2RNR1K1 b - - 1 19,The knight wants to go to c4 via e3.
