N_move,Standard_notation,UCI_notation,FEN_notation,Comment
1,d4,d2d4,rnbqkbnr/pppppppp/8/8/3P4/8/PPP1PPPP/RNBQKBNR b KQkq - 0 1,This move is a tad out of the norm for me :)
2,d5,d7d5,rnbqkbnr/ppp1pppp/8/3p4/3P4/8/PPP1PPPP/RNBQKBNR w KQkq - 0 2,This move is a tad out of the norm for me :)
3,Nf3,g1f3,rnbqkbnr/ppp1pppp/8/3p4/3P4/5N2/PPP1PPPP/RNBQKB1R b KQkq - 1 2,This move is a tad out of the norm for me :)
4,Nf6,g8f6,rnbqkb1r/ppp1pppp/5n2/3p4/3P4/5N2/PPP1PPPP/RNBQKB1R w KQkq - 2 3,This move is a tad out of the norm for me :)
5,e3,e2e3,rnbqkb1r/ppp1pppp/5n2/3p4/3P4/4PN2/PPP2PPP/RNBQKB1R b KQkq - 0 3,This move is a tad out of the norm for me :)
6,Bg4,c8g4,rn1qkb1r/ppp1pppp/5n2/3p4/3P2b1/4PN2/PPP2PPP/RNBQKB1R w KQkq - 1 4,This move is a tad out of the norm for me :)
7,h3,h2h3,rn1qkb1r/ppp1pppp/5n2/3p4/3P2b1/4PN1P/PPP2PP1/RNBQKB1R b KQkq - 0 4,This move is a tad out of the norm for me :)
8,Bf5,g4f5,rn1qkb1r/ppp1pppp/5n2/3p1b2/3P4/4PN1P/PPP2PP1/RNBQKB1R w KQkq - 1 5,"Need to still check the DB if this is a good/right move, but given the history with me it would been a good/right move."
9,c4,c2c4,rn1qkb1r/ppp1pppp/5n2/3p1b2/2PP4/4PN1P/PP3PP1/RNBQKB1R b KQkq - 0 5,"Need to still check the DB if this is a good/right move, but given the history with me it would been a good/right move."
10,Nc6,b8c6,r2qkb1r/ppp1pppp/2n2n2/3p1b2/2PP4/4PN1P/PP3PP1/RNBQKB1R w KQkq - 1 6,"Need to still check the DB if this is a good/right move, but given the history with me it would been a good/right move."
11,cxd5,c4d5,r2qkb1r/ppp1pppp/2n2n2/3P1b2/3P4/4PN1P/PP3PP1/RNBQKB1R b KQkq - 0 6,"Again something ""out of the norm"" for me :)
But the ""best I believe given 5 .. Nc6"
12,Nb4,c6b4,r2qkb1r/ppp1pppp/5n2/3P1b2/1n1P4/4PN1P/PP3PP1/RNBQKB1R w KQkq - 1 7,"Given the pawn on d6, it's the wrong order of moves,"
13,Qa4+,d1a4,r2qkb1r/ppp1pppp/5n2/3P1b2/Qn1P4/4PN1P/PP3PP1/RNB1KB1R b KQkq - 2 7,I believe this was the move that swinged the game.
14,Qd7,d8d7,r3kb1r/pppqpppp/5n2/3P1b2/Qn1P4/4PN1P/PP3PP1/RNB1KB1R w KQkq - 3 8,"yeah, since you can't do Nc6, but still might've been ""beter"""
15,Qxb4,a4b4,r3kb1r/pppqpppp/5n2/3P1b2/1Q1P4/4PN1P/PP3PP1/RNB1KB1R b KQkq - 0 8,"I considered 8 Bb5, but the c6 , 9 dxc6 Nxc6 and the advantage is gone."
16,O-O-O,e8c8,2kr1b1r/pppqpppp/5n2/3P1b2/1Q1P4/4PN1P/PP3PP1/RNB1KB1R w KQ - 1 9,"This also wasn't such a good move, as there wasn't much support for a7.
I would've played b6, followed soon by e5, attacking Q on b4, and pushing to e4"
17,Qa5,b4a5,2kr1b1r/pppqpppp/5n2/Q2P1b2/3P4/4PN1P/PP3PP1/RNB1KB1R b KQ - 2 9,"Not a6, as I would've attacked (in my norm ;^) with 10. Bxa6, bxa6 11. Qxa6 , positional advantage, still two pawns ahead"
18,Kb8,c8b8,1k1r1b1r/pppqpppp/5n2/Q2P1b2/3P4/4PN1P/PP3PP1/RNB1KB1R w KQ - 3 10,"Not a6, as I would've attacked (in my norm ;^) with 10. Bxa6, bxa6 11. Qxa6 , positional advantage, still two pawns ahead"
19,Nc3,b1c3,1k1r1b1r/pppqpppp/5n2/Q2P1b2/3P4/2N1PN1P/PP3PP1/R1B1KB1R b KQ - 4 10,"Needed to get ""some"" protection for d5, but also needed badly to start developing"
20,b6,b7b6,1k1r1b1r/p1pqpppp/1p3n2/Q2P1b2/3P4/2N1PN1P/PP3PP1/R1B1KB1R w KQ - 0 11,"not ""bad"" .. attempting to get Queen away.
At this point I'd rather play 10...Qd6 and following 11. Nb5 Qb6 preventing mate.
I believe this move just tipped the scale badly in my favour."
21,Qa6,a5a6,1k1r1b1r/p1pqpppp/Qp3n2/3P1b2/3P4/2N1PN1P/PP3PP1/R1B1KB1R b KQ - 1 11,"a tad late/early??
Rather 11...Qc8 followed by QxQ or Qb7
or even  11...c6 to prevent the mate attack"
22,Nxd5,f6d5,1k1r1b1r/p1pqpppp/Qp6/3n1b2/3P4/2N1PN1P/PP3PP1/R1B1KB1R w KQ - 0 12,"a tad late/early??
Rather 11...Qc8 followed by QxQ or Qb7
or even  11...c6 to prevent the mate attack"
23,Ne5,f3e5,1k1r1b1r/p1pqpppp/Qp6/3nNb2/3P4/2N1P2P/PP3PP1/R1B1KB1R b KQ - 1 12,12 Nb5 would've been fooled with 12.. c6 and advantage lost
24,Qe6,d7e6,1k1r1b1r/p1p1pppp/Qp2q3/3nNb2/3P4/2N1P2P/PP3PP1/R1B1KB1R w KQ - 2 13,"I had conditional moves ready for 12.. Qc6 13 Nc6  Ka8 14 Qxa7#
and 12 .. Qd6 13 Nb5 Qb4  14 Bd2 and then I'll have a checkmate coming in the next two moves..
at this stage geig73 made this move ;)"
25,Nb5,c3b5,1k1r1b1r/p1p1pppp/Qp2q3/1N1nNb2/3P4/4P2P/PP3PP1/R1B1KB1R b KQ - 3 13,can't prevent the coming Qxa7...
26,f6,f7f6,1k1r1b1r/p1p1p1pp/Qp2qp2/1N1nNb2/3P4/4P2P/PP3PP1/R1B1KB1R w KQ - 0 14,Kc8 15 Qa8#
27,Qxa7+,a6a7,1k1r1b1r/Q1p1p1pp/1p2qp2/1N1nNb2/3P4/4P2P/PP3PP1/R1B1KB1R b KQ - 0 14,Kc8 15 Qa8#
